{
  "$schema": "https://json-schema.org/draft/2020-12/schema",
  "$id": "https://github.com/promptprobe/agentbench/blob/main/schemas/generic-agent.schema.json",
  "type": "object",
  "properties": {
    "schema_version": {
      "type": "string",
      "const": "1"
    },
    "id": {
      "type": "string",
      "minLength": 1,
      "maxLength": 128,
      "pattern": "^[a-z0-9][a-z0-9._-]*$"
    },
    "name": {
      "type": "string",
      "minLength": 1,
      "maxLength": 240
    },
    "instructions": {
      "type": "string",
      "minLength": 1,
      "maxLength": 262144
    },
    "scope": {
      "type": "object",
      "properties": {
        "allowed_actions": {
          "default": [],
          "maxItems": 100,
          "type": "array",
          "items": {
            "type": "string",
            "minLength": 1,
            "maxLength": 240
          }
        },
        "prohibited_actions": {
          "default": [],
          "maxItems": 100,
          "type": "array",
          "items": {
            "type": "string",
            "minLength": 1,
            "maxLength": 240
          }
        }
      },
      "required": [
        "allowed_actions",
        "prohibited_actions"
      ],
      "additionalProperties": false
    },
    "metadata": {
      "type": "object",
      "propertyNames": {
        "type": "string"
      },
      "additionalProperties": {}
    }
  },
  "required": [
    "schema_version",
    "id",
    "instructions"
  ],
  "additionalProperties": false
}
